<?xml version="1.0"?>
<xs:schema xmlns:xs="http://www.w3.org/2001/XMLSchema"
           targetNamespace="http://www.github.com/landyking/link"
           elementFormDefault="qualified"
           attributeFormDefault="unqualified">
    <xs:element name="dicts">
        <xs:complexType>
            <xs:sequence>
                <xs:element name="dict">
                    <xs:complexType>
                        <xs:sequence>
                            <xs:element name="item">
                                <xs:complexType>
                                    <xs:complexContent>
                                        <xs:extension base="xs:string"/>
                                    </xs:complexContent>
                                    <xs:attribute name="code" type="xs:string" use="required"/>
                                </xs:complexType>
                            </xs:element>
                        </xs:sequence>
                        <xs:attribute name="name" type="xs:string" use="required"/>
                    </xs:complexType>
                </xs:element>
            </xs:sequence>
        </xs:complexType>
    </xs:element>
</xs:schema>