<?xml version="1.0" encoding="UTF-8"?>
<dicts xmlns="http://www.github.com/landyking/dict"
       xmlns:xsi="http://www.w3.org/2001/XMLSchema-instance"
       xsi:schemaLocation="http://www.github.com/landyking/dict http://www.github.com/landyking/dict/dict-1.0.xsd">
    <dict name="hello" desc="测试">
        <item code="2">你好</item>
        <item code="21">我也好</item>
        <item code="22">我也好2</item>
    </dict>
    <dict name="world">
        <item code="a">大写A</item>
        <item code="b">大写B</item>
    </dict>
    <dict name="app.marker">
        <item code="1" marker="first">第一</item>
        <item code="2" marker="second">第二</item>
    </dict>
</dicts>